{
	"width": 5,
	"height": 5,
	"data": [
		{
			"position": [
				0,
				0
			],
			"direction": "SOUTH"
		},
		{
			"position": [
				0,
				1
			],
			"direction": "SOUTH"
		},
		{
			"position": [
				0,
				2
			],
			"direction": "SOUTH"
		},
		{
			"position": [
				0,
				3
			],
			"direction": "SOUTH"
		},
		{
			"position": [
				0,
				4
			],
			"direction": "EAST"
		},
		{
			"position": [
				1,
				4
			],
			"direction": "EAST"
		},
		{
			"position": [
				2,
				4
			],
			"direction": "EAST"
		},
		{
			"position": [
				3,
				4
			],
			"direction": "EAST"
		},
		{
			"position": [
				4,
				4
			],
			"direction": "NORTH"
		},
		{
			"position": [
				4,
				3
			],
			"direction": "NORTH"
		},
		{
			"position": [
				4,
				2
			],
			"direction": "NORTH"
		},
		{
			"position": [
				4,
				1
			],
			"direction": "NORTH"
		},
		{
			"position": [
				4,
				0
			],
			"direction": "WEST"
		},
		{
			"position": [
				3,
				0
			],
			"direction": "WEST"
		},
		{
			"position": [
				2,
				0
			],
			"direction": "WEST"
		},
		{
			"position": [
				1,
				0
			],
			"direction": "WEST"
		}
	],
	"name": "5x5 Kreis"
}
